{
  "$schema": "https://oo-ld.org/1.0.0-rc.5/meta/oold-rules.schema.json",
  "$comment": "Catalog of the normative statements in the OO-LD specification, generated from the :rule[...] markers in spec/sections/*.md by scripts/extract_rules.py. Do not edit by hand. Ids are immutable and never reused; see meta/RULES.md.",
  "spec_version": "1.0.0-rc.5",
  "areas": {
    "CNF": "Serialization and conformance",
    "SCH": "Schema well-formedness and the meta-schema",
    "CMP": "Composition, merge and override",
    "INS": "Instances: $schema, identity, semantic type, value forms",
    "RT": "Projection to RDF and round-trip safety",
    "VER": "Identification and versioning",
    "EXT": "Standard extensions (JSON-LD and JSON Schema)"
  },
  "applies_to": {
    "document": "Checkable by validating a schema or instance document",
    "implementation": "Constrains an OO-LD implementation; needs a library conformance suite",
    "advisory": "Guidance; nothing verifies it automatically"
  },
  "rules": [
    {
      "id": "OOLD-CMP-1257",
      "area": "CMP",
      "level": "MUST",
      "applies_to": "document",
      "section": "closing-composed-objects",
      "summary": "A composed object is closed with unevaluatedProperties, not additionalProperties.",
      "text": "A schema that closes a composed object MUST do so with `unevaluatedProperties: false` (JSONSCHEMA §11.3), which is evaluated after the `allOf` branches and therefore accounts for their properties, rather than with `additionalProperties: false`, which does not see them and so rejects instances the composition permits.",
      "text_sha256": "7e3a4ba0adb7bb93289004c49bf1f53410d852293e4be4089eb7d3618c7d5087",
      "context": "Because `allOf` composition is conjunctive, `additionalProperties: false` on one subschema rejects the members that the other composed subschemas contribute, so it cannot close a composed object. A schema that closes a composed object MUST do so with `unevaluatedProperties: false` (JSONSCHEMA §11.3), which is evaluated after the `allOf` branches and therefore accounts for their properties, rather than with `additionalProperties: false`, which does not see them and so rejects instances the composition permits. Note that [](#schema-instances) requires such a schema to still permit the instance-level `$schema` and `@context` members.",
      "machine_checkable": true,
      "since": "1.0.0-rc.3",
      "deprecated": false,
      "source": "06-composition.md:88"
    },
    {
      "id": "OOLD-CMP-1d7e",
      "area": "CMP",
      "level": "MUST NOT",
      "applies_to": "document",
      "section": "merging-remote-contexts",
      "summary": "Reflected oneOf/anyOf branch contexts must not map the same keyword to different IRIs at the root.",
      "text": "The remote contexts of `oneOf` / `anyOf` branches MAY also be reflected into the `@context`, but they MUST NOT conflict at the root - they MUST NOT map the same keyword to different IRIs there.",
      "text_sha256": "2bb32571967d138ce1b962cd0951dbf255af2de7c7bf2a2dbfd42718017dc18e",
      "context": "`oneOf` / `anyOf`. The remote contexts of `oneOf` / `anyOf` branches MAY also be reflected into the `@context`, but they MUST NOT conflict at the root - they MUST NOT map the same keyword to different IRIs there. A JSON-LD processor merges all listed contexts (most-recently-wins) and has no notion of which branch a given instance matched, so a root-level conflict would be decided by context order rather than by the branch the data conforms to.",
      "machine_checkable": true,
      "since": "1.0.0-rc.2",
      "deprecated": false,
      "source": "06-composition.md:49"
    },
    {
      "id": "OOLD-CMP-5266",
      "area": "CMP",
      "level": "SHOULD",
      "applies_to": "document",
      "section": "composition",
      "summary": "An embedded object property should be reflected as that property's scoped JSON-LD context.",
      "text": "An embedded object reached under an object-valued property - one whose value is an object, directly (`type: object`) or as the `items` of an array (`type: array`), whether inlined or brought in by `$ref` - SHOULD be reflected as that property's scoped JSON-LD context, so its terms resolve only under that property and cannot conflict with a same-named term elsewhere.",
      "text_sha256": "62cca7366f12688f2708768b351e60662cb4704c3039f2c7f9243446ec9d21a6",
      "context": "It MUST NOT be required to further process an OO-LD schema document in order to interpret it as a JSON-LD context, so every occurrence of `$ref` in the schema MUST be reflected in the JSON-LD context. An embedded object reached under an object-valued property - one whose value is an object, directly (`type: object`) or as the `items` of an array (`type: array`), whether inlined or brought in by `$ref` - SHOULD be reflected as that property's scoped JSON-LD context, so its terms resolve only under that property and cannot conflict with a same-named term elsewhere. That scoped context MAY reference the embedded schema remotely (by URL) or carry its terms inline. Where the embed graph is cyclic - a value type whose scoped context transitively references itself through remote schema files - JSON-LD processors cannot resolve the recursive remote contexts (see [](#round-trip)); breaking the cycle requires migrating the remote reference to a local (inline) context - inlining the term definitions so there is no remote hop to recurse - which MAY be flattened onto the root context as a shared vocabulary. Moving the remote reference to the root does not break the cycle; only replacing it with local definitions does. A `$ref` at the root level of the OO-LD schema is listed at the root of the JSON-LD context. (A scalar reference - a property whose value is an IRI string, not an embedded object - carries its target type in [`x-oold-range`](#range-of-properties), not a `$ref`, and so contributes no scoped context.) In case of multiple `$ref` within `allOf` the corresponding remote contexts are merged into an array-valued `@context` (see [](#merging-remote-contexts)). For `oneOf` / `anyOf` this requires care to avoid conflicts. At any time the importing OO-LD schema MAY define its own or override the imported JSON-LD context.",
      "machine_checkable": true,
      "since": "1.0.0-rc.2",
      "deprecated": false,
      "source": "06-composition.md:5"
    },
    {
      "id": "OOLD-CMP-53bf",
      "area": "CMP",
      "level": "SHOULD",
      "applies_to": "document",
      "section": "merging-remote-contexts",
      "summary": "A schema's JSON Schema and JSON-LD base URIs should be aligned so a relative reference resolves the same under both.",
      "text": "Relative references resolve against the schema's `$id` (the JSON Schema base URI) and, on the JSON-LD side, against `@base` / the retrieval URL; these base URIs SHOULD be aligned so a relative reference resolves to the same absolute URL under both.",
      "text_sha256": "47730120a068a22fa8d75d91b9797166ad500f332b8b84e06f82476d15296511",
      "context": "Independent references and base URIs. A JSON Schema `$ref` and a JSON-LD `@context` entry are independent references: they MAY point to the same document (the typical OO-LD case, where one document is both a schema and a context) or to different documents - for example a plain JSON Schema referenced via `$ref` together with a separate remote `@context` that supplies the semantics. Relative references resolve against the schema's `$id` (the JSON Schema base URI) and, on the JSON-LD side, against `@base` / the retrieval URL; these base URIs SHOULD be aligned so a relative reference resolves to the same absolute URL under both. `$id` MUST NOT contain a non-empty fragment (JSONSCHEMA §8.2.1).",
      "machine_checkable": true,
      "since": "1.0.0-rc.2",
      "deprecated": false,
      "source": "06-composition.md:74"
    },
    {
      "id": "OOLD-CMP-6d7b",
      "area": "CMP",
      "level": "MUST",
      "applies_to": "document",
      "section": "merging-remote-contexts",
      "summary": "Branch-specific mappings for the same keyword must be scoped rather than placed at the root.",
      "text": "Where branches genuinely need different mappings for the same keyword, those mappings MUST be scoped with JSON-LD scoped contexts so each applies only where its branch applies, rather than placed at the root, since colliding root mappings are resolved by context order instead of by the branch the data conforms to: Type-scoped contexts when the branches are distinguished by `@type`. The",
      "text_sha256": "20a163b888e4fc79898974b0e846bb25df1e73dec7bb5fd434a19934bef7e47a",
      "context": "Where branches genuinely need different mappings for the same keyword, those mappings MUST be scoped with JSON-LD scoped contexts so each applies only where its branch applies, rather than placed at the root, since colliding root mappings are resolved by context order instead of by the branch the data conforms to:\n- Type-scoped contexts when the branches are distinguished by `@type`. The",
      "machine_checkable": true,
      "since": "1.0.0-rc.2",
      "deprecated": false,
      "source": "06-composition.md:51"
    },
    {
      "id": "OOLD-CMP-a05a",
      "area": "CMP",
      "level": "MUST",
      "applies_to": "document",
      "section": "merging-remote-contexts",
      "summary": "A scoped context that must apply only to the immediate node sets @propagate false; contexts in one array share it.",
      "text": "Where a referenced context should apply only to the immediate node, the schema MUST set `\"@propagate\": false` on that scoped context.",
      "text_sha256": "c9059a4861176c0efa21e2f497d557b096d3105ca0cf872497191c5ed80cc7e8",